{
  "$schema": "http://json-schema.org/draft-07/schema#",
  "$id": "https://github.com/CitriData/dataModel.Agrifood/blob/main/InternationalCitrusTrade/schema.json",
  "title": "InternationalCitrusTrade",
  "description": "Data model for international trade statistics of citrus products, based on sources such as UN Comtrade and aligned with global trade data standards. It captures key variables including origin/destination countries, HS codes, trade values, volumes, and time periods. Designed to support consistent analysis, comparison, and integration with economic data systems.",
  "type": "object",
  "required": [
    "id",
    "type",
    "period",
    "reporterCode",
    "partnerCode",
    "flowCode"
  ],
  "properties": {
    "id": {
      "type": "string",
      "format": "uri",
      "description": "Unique identifier of the entity."
    },
    "type": {
      "type": "string",
      "description": "Property. NGSI Entity Type. It has to be InternationalCitrusTrade.",
      "enum": [
        "InternationalCitrusTrade"
      ]
    },
    "cmdDesc": {
      "type": "string",
      "description": "Property. Model:'https://schema.org/Text'. Units: 'Products'. Commodity description"
    },
    "flowDesc": {
      "type": "string",
      "description": "Property. Model:'https://schema.org/Text'. Units: 'Flow'. Description of the trade flow"
    },
    "reporterDesc": {
      "type": "string",
      "description": "Property. Model:'https://schema.org/Text'. Units: 'Country'. Country or region reporting the trade."
    },
    "partnerDesc": {
      "type": "string",
      "description": "Property. Model:'https://schema.org/Text'. Units: 'Country'. Primary trading partner country or region."
    },
    "qty": {
      "type": "number",
      "description": "Property. Model:'https://schema.org/Number'. Units: 'qtyUnitAbbr'. Trade quantity"
    },
    "qtyUnitAbbr": {
      "type": "string",
      "description": "Property. Model:'https://schema.org/Text'. Units: 'SI Units'. Abbreviation of the quantity unit."
    },
    "altQty": {
      "type": "number",
      "description": "Property. Model:'https://schema.org/Number'. Units: 'altQtyUnitAbbr'. Alternative trade quantity if applicable."
    },
    "altQtyUnitAbbr": {
      "type": "string",
      "description": "Property. Model:'https://schema.org/Text'. Units: 'Alternative units'. Abbreviation of the alternative quantity unit."
    },
    "refYear": {
      "type": "number",
      "description": "Property. Model:'https://schema.org/Number'. Units: 'YYYY'. Reference year of the trade record."
    },
    "refMonth": {
      "type": "number",
      "description": "Property. Model:'https://schema.org/Number'. Units: 'MM'. Reference month of the trade record."
    },
    "motDesc": {
      "type": "string",
      "description": "Property. Model:'https://schema.org/Text'. Units: 'Mode of Transport'. Mode of Transport description."
    },
    "cifvalue": {
      "type": "number",
      "description": "Property. Model:'https://schema.org/Number'. Units: 'USD ($)'. Cost, Insurance, and Freight (CIF) value."
    },
    "classificationCode": {
      "type": "string",
      "description": "Property. Model:'https://schema.org/Text'. Units: 'Code'. Product classification code."
    },
    "classificationSearchCode": {
      "type": "string",
      "description": "Property. Model:'https://schema.org/Text'. Units: 'Code'. Search code used for the classification."
    },
    "customsCode": {
      "type": "string",
      "description": "Property. Model:'https://schema.org/Text'. Units: 'Code'. Customs procedure code."
    },
    "customsDesc": {
      "type": "string",
      "description": "Property. Model:'https://schema.org/Text'. Units: 'Customs Procedure'. Description of the customs procedure."
    },
    "flowCode": {
      "type": "string",
      "description": "Property. Model:'https://schema.org/Text'. Units: 'Code'. Code identifying the trade flow type."
    },
    "fobvalue": {
      "type": "number",
      "description": "Property. Model:'https://schema.org/Number'. Units: 'USD ($)'. Free on Board (FOB) value."
    },
    "freqCode": {
      "type": "string",
      "description": "Property. Model:'https://schema.org/Text'. Units: 'Monthly'. Frequency code."
    },
    "grossWgt": {
      "type": "number",
      "description": "Property. Model:'https://schema.org/Number'. Units: 'kg'. Gross weight."
    },
    "isAggregate": {
      "type": "boolean",
      "description": "Property. Model:'https://schema.org/Boolean'. Units: 'true/false'. Flag indicating if the data is aggregated."
    },
    "aggrLevel": {
      "type": "number",
      "description": "Property. Model:'https://schema.org/Number'. Units: 'Code'. Level of data aggregation."
    },
    "isAltQtyEstimated": {
      "type": "boolean",
      "description": "Property. Model:'https://schema.org/Boolean'. Units: 'true/false'. Flag indicating if the alternative quantity is estimated."
    },
    "isGrossWgtEstimated": {
      "type": "boolean",
      "description": "Property. Model:'https://schema.org/Boolean'. Units: 'true/false'. Flag indicating if the gross weight is estimated."
    },
    "isLeaf": {
      "type": "boolean",
      "description": "Property. Model:'https://schema.org/Boolean'. Units: 'true/false'. Flag indicating if this is the lowest level of the product classification tree."
    },
    "isNetWgtEstimated": {
      "type": "boolean",
      "description": "Property. Model:'https://schema.org/Boolean'. Units: 'true/false'. Flag indicating if the net weight is estimated."
    },
    "isOriginalClassification": {
      "type": "boolean",
      "description": "Property. Model:'https://schema.org/Boolean'. Units: 'true/false'. Flag indicating if original classification was used."
    },
    "isQtyEstimated": {
      "type": "boolean",
      "description": "Property. Model:'https://schema.org/Boolean'. Units: 'true/false'. Flag indicating if the quantity is estimated."
    },
    "isReported": {
      "type": "boolean",
      "description": "Property. Model:'https://schema.org/Boolean'. Units: 'true/false'. Flag indicating if the data was explicitly reported by the country."
    },
    "legacyEstimationFlag": {
      "type": "string",
      "description": "Property. Model:'https://schema.org/Text'. Units: 'Code'. Legacy system flag for estimations."
    },
    "mosCode": {
      "type": "string",
      "description": "Property. Model:'https://schema.org/Text'. Units: 'Code'. Mode of Supply code."
    },
    "motCode": {
      "type": "string",
      "description": "Property. Model:'https://schema.org/Text'. Units: 'Code'. Mode of Transport code."
    },
    "netWgt": {
      "type": "number",
      "description": "Property. Model:'https://schema.org/Number'. Units: 'kg'. Net weight."
    },
    "partner2Code": {
      "type": "string",
      "description": "Property. Model:'https://schema.org/Text'. Units: 'Code'. Code of the secondary partner country."
    },
    "partner2Desc": {
      "type": "string",
      "description": "Property. Model:'https://schema.org/Text'. Units: 'Country'. Description of the second partner country."
    },
    "partner2ISO": {
      "type": "string",
      "description": "Property. Model:'https://schema.org/Text'. Units: 'ISO Code'. ISO Code of the secondary partner country."
    },
    "partnerCode": {
      "type": "string",
      "description": "Property. Model:'https://schema.org/Text'. Units: 'Code'. Code of the primary partner country."
    },
    "partnerISO": {
      "type": "string",
      "description": "Property. Model:'https://schema.org/Text'. Units: 'ISO Code'. ISO code of the primary partner country."
    },
    "period": {
      "type": "string",
      "description": "Property. Model:'https://schema.org/Text'. Units: 'YYYYMM'. The period of the trade data."
    },
    "primaryValue": {
      "type": "number",
      "description": "Property. Model:'https://schema.org/Number'. Units: 'USD ($)'. The primary statistical value recorded."
    },
    "qtyUnitCode": {
      "type": "number",
      "description": "Property. Model:'https://schema.org/Number'. Units: 'Code'. Code for the quantity unit."
    },
    "altQtyUnitCode": {
      "type": "number",
      "description": "Property. Model:'https://schema.org/Number'. Units: 'Code'. Code for the alternative quantity unit."
    },
    "refPeriodId": {
      "type": "string",
      "description": "Property. Model:'https://schema.org/Text'. Units: 'YYYYMM00'. Internal reference period identifier."
    },
    "reporterCode": {
      "type": "string",
      "description": "Property. Model:'https://schema.org/Text'. Units: 'Code'. Code of the reporting country."
    },
    "reporterISO": {
      "type": "string",
      "description": "Property. Model:'https://schema.org/Text'. Units: 'ISO Code'. ISO code of the reporting country."
    },
    "typeCode": {
      "type": "string",
      "description": "Property. Model:'https://schema.org/Text'. Units: 'Code'. Type code of the trade record."
    }
  }
}
