{
  "id": "urn:ngsi-ld:InternationalCitrusTrade:COMTRADE-2026-05-ES-ORANGES",
  "type": "InternationalCitrusTrade",
  "period": "202605",
  "refYear": 2026,
  "refMonth": 5,
  "cmdDesc": "Fresh lemons and limes",
  "classificationCode": "080550",
  "flowDesc": "Export",
  "flowCode": "X",
  "reporterDesc": "Spain",
  "reporterISO": "ESP",
  "reporterCode": "724",
  "partnerDesc": "United Kingdom",
  "partnerISO": "GBR",
  "partnerCode": "826",
  "qty": 450000,
  "qtyUnitAbbr": "kg",
  "qtyUnitCode": 8,
  "netWgt": 450000,
  "grossWgt": 462000,
  "fobvalue": 380000.00,
  "isAggregate": false,
  "isQtyEstimated": false,
  "isNetWgtEstimated": false,
  "isLeaf": true,
  "typeCode": "G"
}